{
  "schema": "cheatengine-client-tuple/v0",
  "stage": "PrePublish",
  "source": {
    "repository": "CheatEngineNet/CheatEngine.Client",
    "tag": "v0.1.0",
    "commit": "fa9c77bb0fa92400b657a871b64fce1614172733",
    "treeHash": "83b0ccb7ad2a608d0c9c39d4597fe0cbe0437730",
    "pullRequest": null,
    "releaseRunUrl": "https://github.com/CheatEngineNet/CheatEngine.Client/actions/runs/0",
    "ciRunUrl": "https://github.com/CheatEngineNet/CheatEngine.Client/actions/runs/0"
  },
  "build": {
    "dotnetSdk": "10.0.401",
    "globalJsonSha256": "2dad758d7b2aef5413c0df4fcb1d79f7ea2050465b4cc80c8fd51045f6777418",
    "runner": {
      "label": "windows-2025",
      "imageOs": "local-rehearsal",
      "imageVersion": "local-rehearsal"
    },
    "roslynFloor": "5.9.0",
    "analysisLevel": "10.0-recommended"
  },
  "ceProfile": {
    "profileId": "ce-7.7.0.10621-x64-managed-hostfxr",
    "supportProfileSha256": null
  },
  "qualification": {
    "matrixSha256": null,
    "receipts": []
  },
  "sbom": {
    "entry": "_manifest/spdx_2.2/manifest.spdx.json",
    "spdxVersion": "SPDX-2.2",
    "attested": false,
    "documents": [
      {
        "id": "CheatEngine.Client",
        "sha256": "2160449172c5bd1e7410f6d56608c81a3562d8ed711b5d92b181be2ea5b0beee"
      },
      {
        "id": "CheatEngine.Client.Abstractions",
        "sha256": "4343d0d6a4d063665cfa6371fe3f868a20090cffe68f36f8ac1c02660682bce1"
      },
      {
        "id": "CheatEngine.Client.Core",
        "sha256": "cf61ad41ae492e7983d5763ae62bad1565a67ccd304c31c32f96ffc42cbceb4f"
      },
      {
        "id": "CheatEngine.Client.Extensions.DependencyInjection",
        "sha256": "9b668574b912e1481581d9c6fda2115561f8a77de99d1af4a7a89ac0a8d77788"
      },
      {
        "id": "CheatEngine.Client.Fluent",
        "sha256": "d74523f743cb9a69b48e43d3eb19b2ffc8b713d935a02cc0cd0422373c180283"
      },
      {
        "id": "CheatEngine.Client.Hosting",
        "sha256": "fbfed4d5eb020a0266fb8e95c35cf14cddf56a08cd70161e5353c89d508df772"
      },
      {
        "id": "CheatEngine.Client.Templates",
        "sha256": "0d399d26cfc6e7fec223ee311969f175722cd0d92f33c7b31c2f40f33a33e3e8"
      }
    ]
  },
  "attestations": {
    "provenanceBundle": "CheatEngine.Client.0.1.0.provenance.sigstore.json",
    "sbomBundles": [
      {
        "id": "CheatEngine.Client",
        "bundle": "CheatEngine.Client.0.1.0.sbom.sigstore.json"
      },
      {
        "id": "CheatEngine.Client.Abstractions",
        "bundle": "CheatEngine.Client.Abstractions.0.1.0.sbom.sigstore.json"
      },
      {
        "id": "CheatEngine.Client.Core",
        "bundle": "CheatEngine.Client.Core.0.1.0.sbom.sigstore.json"
      },
      {
        "id": "CheatEngine.Client.Extensions.DependencyInjection",
        "bundle": "CheatEngine.Client.Extensions.DependencyInjection.0.1.0.sbom.sigstore.json"
      },
      {
        "id": "CheatEngine.Client.Fluent",
        "bundle": "CheatEngine.Client.Fluent.0.1.0.sbom.sigstore.json"
      },
      {
        "id": "CheatEngine.Client.Hosting",
        "bundle": "CheatEngine.Client.Hosting.0.1.0.sbom.sigstore.json"
      },
      {
        "id": "CheatEngine.Client.Templates",
        "bundle": "CheatEngine.Client.Templates.0.1.0.sbom.sigstore.json"
      }
    ]
  },
  "assets": [
    {
      "name": "CheatEngine.Client.0.1.0.nupkg",
      "sha256": "6adfec78e3b9ab372aaa883832ec4106be31eae2879299b9af4ac38ff2e18a19"
    },
    {
      "name": "CheatEngine.Client.0.1.0.spdx.json",
      "sha256": "2160449172c5bd1e7410f6d56608c81a3562d8ed711b5d92b181be2ea5b0beee"
    },
    {
      "name": "CheatEngine.Client.Abstractions.0.1.0.nupkg",
      "sha256": "a83ec8a8cb4d1192b18abbb1947f118ebe6695ff8f16e14c9a1c51ac792e393b"
    },
    {
      "name": "CheatEngine.Client.Abstractions.0.1.0.snupkg",
      "sha256": "3836ab8cb88a30f91ca740f030a97ce9ac453f5bc57a0b6ddda063af4a22bbb1"
    },
    {
      "name": "CheatEngine.Client.Abstractions.0.1.0.spdx.json",
      "sha256": "4343d0d6a4d063665cfa6371fe3f868a20090cffe68f36f8ac1c02660682bce1"
    },
    {
      "name": "CheatEngine.Client.Core.0.1.0.nupkg",
      "sha256": "4ecef8a79947387966dbd460d2ebf83fd82cdc299eaef61881611b6974551a5b"
    },
    {
      "name": "CheatEngine.Client.Core.0.1.0.snupkg",
      "sha256": "e1528bb7b9cc053d8e1236e1da42a746ab91f5e012ee671b25b9c720effd95e9"
    },
    {
      "name": "CheatEngine.Client.Core.0.1.0.spdx.json",
      "sha256": "cf61ad41ae492e7983d5763ae62bad1565a67ccd304c31c32f96ffc42cbceb4f"
    },
    {
      "name": "CheatEngine.Client.Extensions.DependencyInjection.0.1.0.nupkg",
      "sha256": "447625120832a673f59a3d8002381cbc9d43f12ec07137152496b4cef3dce53f"
    },
    {
      "name": "CheatEngine.Client.Extensions.DependencyInjection.0.1.0.snupkg",
      "sha256": "b5192043732be3cbc3b8354f232ed2af4200f4f7a1cbf0ce7d4e261d425c876c"
    },
    {
      "name": "CheatEngine.Client.Extensions.DependencyInjection.0.1.0.spdx.json",
      "sha256": "9b668574b912e1481581d9c6fda2115561f8a77de99d1af4a7a89ac0a8d77788"
    },
    {
      "name": "CheatEngine.Client.Fluent.0.1.0.nupkg",
      "sha256": "91930d04f8492f4fdf716df42c9b4ebfa2d4467b1e43bbf2a015809ebb4ecb01"
    },
    {
      "name": "CheatEngine.Client.Fluent.0.1.0.snupkg",
      "sha256": "abe8db763fca2bef3672e25d648a6c6e1c8e1698077a24bae3205e7527fa4806"
    },
    {
      "name": "CheatEngine.Client.Fluent.0.1.0.spdx.json",
      "sha256": "d74523f743cb9a69b48e43d3eb19b2ffc8b713d935a02cc0cd0422373c180283"
    },
    {
      "name": "CheatEngine.Client.Hosting.0.1.0.nupkg",
      "sha256": "f8bebce18899daf4e496115791a5fe86de7559783fd208f56bd5cdd2cb99982c"
    },
    {
      "name": "CheatEngine.Client.Hosting.0.1.0.snupkg",
      "sha256": "73643727194594a4d2caccadcbc359a371462a2cec99ec5d7e146d3ce8f8bee3"
    },
    {
      "name": "CheatEngine.Client.Hosting.0.1.0.spdx.json",
      "sha256": "fbfed4d5eb020a0266fb8e95c35cf14cddf56a08cd70161e5353c89d508df772"
    },
    {
      "name": "CheatEngine.Client.Templates.0.1.0.nupkg",
      "sha256": "089765379a894d9ed8732a0bc4bb7bbf82dd3a507692d44e3e781e8db596f245"
    },
    {
      "name": "CheatEngine.Client.Templates.0.1.0.spdx.json",
      "sha256": "0d399d26cfc6e7fec223ee311969f175722cd0d92f33c7b31c2f40f33a33e3e8"
    }
  ],
  "client": {
    "version": "0.1.0",
    "packages": [
      {
        "id": "CheatEngine.Client",
        "version": "0.1.0",
        "attestedAssetSha256": "6adfec78e3b9ab372aaa883832ec4106be31eae2879299b9af4ac38ff2e18a19",
        "contentHashSha512": "Bv3PBPFFBojzp6jp7sCtf2crlKvPAQYHG2R3kIR5LcRr+FAiBn2zX1b3J/pgIy2fenBTsCpoHZzQTNYM95eCxA==",
        "nugetOrgSignedSha256": null,
        "snupkgSha256": null
      },
      {
        "id": "CheatEngine.Client.Abstractions",
        "version": "0.1.0",
        "attestedAssetSha256": "a83ec8a8cb4d1192b18abbb1947f118ebe6695ff8f16e14c9a1c51ac792e393b",
        "contentHashSha512": "k8xuoV+PByBF6O+/BHc8nY0wzhw2U0jhmdd2X4KHehLHJ7yxcDZuqpgL0L79rvmdcATuhcQJ6mbuQZ3B2W1j4Q==",
        "nugetOrgSignedSha256": null,
        "snupkgSha256": "3836ab8cb88a30f91ca740f030a97ce9ac453f5bc57a0b6ddda063af4a22bbb1"
      },
      {
        "id": "CheatEngine.Client.Core",
        "version": "0.1.0",
        "attestedAssetSha256": "4ecef8a79947387966dbd460d2ebf83fd82cdc299eaef61881611b6974551a5b",
        "contentHashSha512": "ih+XyUCcpJjwXgMLD7IBsAwHbF8Y1h8oOIHWnr/C2syCmqz/HMWhH2RppN3dW/+BDr1WSKsX3WvsB1W8QT4UNQ==",
        "nugetOrgSignedSha256": null,
        "snupkgSha256": "e1528bb7b9cc053d8e1236e1da42a746ab91f5e012ee671b25b9c720effd95e9"
      },
      {
        "id": "CheatEngine.Client.Extensions.DependencyInjection",
        "version": "0.1.0",
        "attestedAssetSha256": "447625120832a673f59a3d8002381cbc9d43f12ec07137152496b4cef3dce53f",
        "contentHashSha512": "wVYVA4JAjR8JmYrypSReq55CrhH8obafXNqfA+ddDC0tS+tivJ+IGTpD1Y68u+hAvUt/QVzDl5UbXwVnsFSitQ==",
        "nugetOrgSignedSha256": null,
        "snupkgSha256": "b5192043732be3cbc3b8354f232ed2af4200f4f7a1cbf0ce7d4e261d425c876c"
      },
      {
        "id": "CheatEngine.Client.Fluent",
        "version": "0.1.0",
        "attestedAssetSha256": "91930d04f8492f4fdf716df42c9b4ebfa2d4467b1e43bbf2a015809ebb4ecb01",
        "contentHashSha512": "Ke87ULxkWBNl4OM8q13koDeS5357mv9JCmkZnTJK99Kf6E5Q0ZsfG9n1c8X2f4/d/tenLZff9hCMnq2GFuqSjQ==",
        "nugetOrgSignedSha256": null,
        "snupkgSha256": "abe8db763fca2bef3672e25d648a6c6e1c8e1698077a24bae3205e7527fa4806"
      },
      {
        "id": "CheatEngine.Client.Hosting",
        "version": "0.1.0",
        "attestedAssetSha256": "f8bebce18899daf4e496115791a5fe86de7559783fd208f56bd5cdd2cb99982c",
        "contentHashSha512": "5IruUmwVciuGsBxt9/xYWb/tkejiTaBnC6QtgEZyxtVYqgyjXjSaGuuJi0uINv0x5oNVb+Vd0PkRoAQV925LbA==",
        "nugetOrgSignedSha256": null,
        "snupkgSha256": "73643727194594a4d2caccadcbc359a371462a2cec99ec5d7e146d3ce8f8bee3"
      },
      {
        "id": "CheatEngine.Client.Templates",
        "version": "0.1.0",
        "attestedAssetSha256": "089765379a894d9ed8732a0bc4bb7bbf82dd3a507692d44e3e781e8db596f245",
        "contentHashSha512": "pl3c2KmJCY/+cabngc/BuAs4Uahk0xWt8GuGQ/kHpdyqGjZicfHEBFSmLhG2ex8GHH9LJGwvSm/QWS2BXjI3Ow==",
        "nugetOrgSignedSha256": null,
        "snupkgSha256": null
      }
    ]
  },
  "consumedSdk": {
    "id": "CheatEngine.SDK",
    "version": "1.0.0",
    "range": "[1.0.0, 2.0.0)",
    "contentHashSha512": "n7nHqZ8vzo7Vf20jF0fkh/jUtR3yo1TwRGpXE7ERxZeJ4C5S/Nsft4lqOg7zGwfsD5Nh9tTVgdw4PrybJRF0gA==",
    "attestedAssetSha256": "99bf90101cd13e0183c94759e43badc6a1e719ffc3e2c9fd0b93490abdac0632",
    "nugetOrgSignedSha256": "3e8c98583ac71af25a5bd7053e7583fbafcd196139fae7c0b04bae9b40a7cd33",
    "sourceCommit": "a6fefb93e9c6f85a1bcedb68bf97e6741175b227",
    "nativeBridge": {
      "sha256": "da08c2ba03019da3a8c432ef061d5d6133fd2169ba3a6a8e9ac903353856d994",